<?xml version="1.0" encoding="UTF-8" standalone="no"?>

<bookshop xsi:noNamespaceSchemaLocation="bookshop_xml_shema.xsd" xmlns:xsi="http://www.w3.org/2001/XMLSchema-instance">
	<ScientificProducts>
		<book type="scientific" isbn="h-78">
			<title> Cybersecurity</title>
			<ListingAuthors>
				<authors ID="P1">
					<person sexe="M">
						<name>Siewe</name>
						<FirstName>Anicet</FirstName>
						<adresse>
							<numero>7</numero>
							<rue>impasse du chemin</rue>
							<PostalCode>7505</PostalCode>
							<city>Bruxelle</city>
							<country>Belgique</country>
						</adresse>
						<Phones>
							<Phone type="HousePhone" locality="BEL">03265765675675</Phone>
							<Phone type="cellphone" locality="BEL">03265765765675</Phone>
							<Phone type="OfficePhone" locality="BEL">0325865675</Phone>
						</Phones>
						<emails>
							<email type="personnel">asiewekoulbacbe</email>
							<email type="professionnel">asieweko@ulb.ac.be</email>
						</emails>
					</person>
				</authors>
			</ListingAuthors>
			<publisher>ULB</publisher>
			<YearPublication>2016</YearPublication>
			<abstract>Cryptography Systems and Networks Legal, ethics, and human aspects Management of the Security Secure software engineering</abstract>
			<edition>edition NATAN</edition>
		</book>
		<journals>
			<title> RESEARCH LABS</title>
			<volume>67</volume>
			<number>7654</number>
			<ListingAuthors>
				<authors ID="drt">
					<person sexe="M">
						<name>DOE</name>
						<FirstName>John</FirstName>
						<adresse>
							<numero>7</numero>
							<rue>impasse du chemin</rue>
							<PostalCode>7515</PostalCode>
							<city>PARIS</city>
							<country>FRANCE</country>
						</adresse>
						<Phones>
							<Phone type="HousePhone" locality="BEL">03265765675675</Phone>
							<Phone type="cellphone" locality="BEL">0325865675</Phone>
							<Phone type="OfficePhone" locality="BEL">0325865675</Phone>
						</Phones>
						<emails>
							<email type="personnel">asieweko@ulb.ac.be</email>
							<email type="professionnel">asieweko@ulb.ac.be</email>
						</emails>
					</person>
				</authors>
			</ListingAuthors>
			<YearPublication>2019</YearPublication>
			<publisher>Nom de l'editeur</publisher>
			<ImpactFactor Year="2019"> Type pas encorre connue</ImpactFactor>
			<contents>
				<article>
					<title> Article 1</title>
					<ListingAuthors>
						<authors ID="eds">
							<person sexe="M">
								<name>Anicet</name>
								<FirstName>Siewe</FirstName>
								<adresse>
									<numero>7</numero>
									<rue>impasse du chemin</rue>
									<PostalCode>7515</PostalCode>
									<city>Bruxelle</city>
									<country>Belgique</country>
								</adresse>
								<Phones>
									<Phone type="HousePhone" locality="BEL">03265765675675</Phone>
									<Phone type="cellphone" locality="BEL">03265765675675</Phone>
									<Phone type="OfficePhone" locality="BEL">0325865675</Phone>
								</Phones>
								<emails>
									<email type="personnel">asieweko@ulb.ac.be</email>
									<email type="professionnel">asieweko@ulb.ac.be</email>
								</emails>
							</person>
						</authors>
					</ListingAuthors>
					<NumPage>
						<StartPage>45</StartPage>
						<EndPage>100</EndPage>
						<!-- <NumArticle>56</NumArticle> -->
					</NumPage>
				</article>
			</contents>
		</journals>
	</ScientificProducts>
	<LeisureProducts>
		<book type="leisure" genre="thriller">
			<title> Teste du title du livre</title>
			<ListingAuthors>
						<authors ID="PTs">
							<person sexe="M">
								<name>Anicet</name>
								<FirstName>Siewe</FirstName>
								<adresse>
									<numero>7</numero>
									<rue>impasse du chemin</rue>
									<PostalCode>7515</PostalCode>
									<city>Bruxelle</city>
									<country>Belgique</country>
								</adresse>
								<Phones>
									<Phone type="HousePhone" locality="BEL">03265765675675</Phone>
									<Phone type="cellphone" locality="BEL">03265765675675</Phone>
									<Phone type="OfficePhone" locality="BEL">0325865675</Phone>
								</Phones>
								<emails>
									<email type="personnel">asieweko@ulb.ac.be</email>
									<email type="professionnel">asieweko@ulb.ac.be</email>
								</emails>
							</person>
						</authors>
					</ListingAuthors>
			<publisher>Nom de l'editeur</publisher>
			<YearPublication>2017</YearPublication>
			<edition>edition NATAN</edition>
			<PageNum>56</PageNum>
		</book>
		<periodicals>
			<title> Teste du title du livre</title>
			<price currency="EURO">300</price>
			<publisher>Nom de l'editeur</publisher>
		</periodicals>
	</LeisureProducts>
</bookshop>
